{
  "approval_id": "apr-translation_qa-20260808t233433z-26cda3",
  "project_id": "yt-MFuUIoF5PSc",
  "gate": "translation_qa",
  "language": "en",
  "approver": "Qaiser Abbas",
  "approver_role": null,
  "decision": "APPROVED",
  "artifact_hashes": [
    "sha256:5115f1e4110dae15a634437fcf0c29defaa2cfbb1b35855ee630fad5238ea65f"
  ],
  "scope": "captions",
  "exclusions": [],
  "notes": "Human approved en translation post no-transliteration regen. Verified cue 0 (the original bug's exact line) renders «Arabic» ('translation') with zero transliteration in captions.en.json AND freshly-rebuilt .srt/.vtt (old .srt was a stale pre-reset leftover, now regenerated via captions build for all 8 langs). Full 24-file scan (json/srt/vtt x 8 langs) found zero real transliteration hits.",
  "created_at": "2026-08-08T23:34:33Z",
  "expires_at": null,
  "invalidated_at": null,
  "invalidation_reason": null
}
