{
  "approval_id": "apr-audio_qa-20260806t085043z-7dc8b5",
  "project_id": "yt-YP0FDR7Wc-8",
  "gate": "audio_qa",
  "language": "ur",
  "approver": "Qaiser Abbas",
  "approver_role": null,
  "decision": "APPROVED",
  "artifact_hashes": [
    "sha256:ac7b8e3da2eb9482a35a7b92945e25c732d97ef8b72a84c68ac8f018e757971b"
  ],
  "scope": "audio",
  "exclusions": [],
  "notes": "audio_qa APPROVE ur: audio-sync PASS. Freeze-frame hold-only (Model B), 3 holds/2731ms, residual 180ms (clean). Human confirmed in-conversation 2026-08-06.",
  "created_at": "2026-08-06T08:50:43Z",
  "expires_at": null,
  "invalidated_at": null,
  "invalidation_reason": null
}
