{
  "approval_id": "apr-translation_qa-20260806t005140z-59ddd0",
  "project_id": "yt-YP0FDR7Wc-8",
  "gate": "translation_qa",
  "language": "en",
  "approver": "Qaiser Abbas",
  "approver_role": null,
  "decision": "APPROVED",
  "artifact_hashes": [
    "sha256:fa0e296a3cd1dc7b1063abccaa198f4cd6d4777f8e94b40e1be5ac0e30432411"
  ],
  "scope": "translation_qa",
  "exclusions": [],
  "notes": "APPROVED as-is 2026-08-06. QA PASS/0 findings; advisory flags (quran-verse/editorial-religious/terminology/long-cue) accepted. See reviews/translation-qa-en-human-note.md",
  "created_at": "2026-08-06T00:51:40Z",
  "expires_at": null,
  "invalidated_at": null,
  "invalidation_reason": null
}
