{
  "approval_id": "apr-audio_qa-20260807t115228z-51b0a6",
  "project_id": "yt-YP0FDR7Wc-8",
  "gate": "audio_qa",
  "language": "ar",
  "approver": "Qaiser Abbas",
  "approver_role": null,
  "decision": "APPROVED",
  "artifact_hashes": [
    "sha256:84cef5116fa5d97c3ca418e962f7b5329a73bed37ac4bfcd0e9755025d937256"
  ],
  "scope": "audio",
  "exclusions": [],
  "notes": "audio_qa APPROVE ar. audio-sync PASS, residual 0. Model A freeze+trim: 87 holds/40528ms incl one accepted 7725ms frozen frame (max_freeze_ms_per_cue raised to 8000), and 32895ms of source frames trimmed across 71 cue-boundary trims. Accepted vs a large desync. Human confirmed in-conversation 2026-08-07 (rule 13).",
  "created_at": "2026-08-07T11:52:28Z",
  "expires_at": null,
  "invalidated_at": null,
  "invalidation_reason": null
}
