{
  "approval_id": "apr-transcript_qa-20260803t053454z-b9d4f3",
  "project_id": "yt-smoke0p3aa",
  "gate": "transcript_qa",
  "language": null,
  "approver": "human",
  "approver_role": null,
  "decision": "APPROVED",
  "artifact_hashes": [
    "sha256:31d9c456b33764ca006071680b63004e95a73360490737e4fb16a9e20abc6325"
  ],
  "scope": "transcript",
  "exclusions": [],
  "notes": null,
  "created_at": "2026-08-03T05:34:54Z",
  "expires_at": null,
  "invalidated_at": null,
  "invalidation_reason": null
}
