{
  "approval_id": "apr-audio_qa-20260811t025626z-00e5d7",
  "project_id": "yt-MFuUIoF5PSc",
  "gate": "audio_qa",
  "language": "es",
  "approver": "Qaiser Abbas",
  "approver_role": null,
  "decision": "APPROVED",
  "artifact_hashes": [
    "sha256:6a7f61beb74c71af7934219471b1e14467e6b0c603771af98c1d00c0f529683d"
  ],
  "scope": "audio",
  "exclusions": [],
  "notes": "Approved via /hi audio-sync QA review 2026-08-11: 0ms drift, 0 cues over tolerance/stretch-cap, no freeze plan (still-image project), max silent span 5220ms (under 7000ms threshold). Confirmed by Qaiser Abbas.",
  "created_at": "2026-08-11T02:56:26Z",
  "expires_at": null,
  "invalidated_at": null,
  "invalidation_reason": null
}
