{
  "approval_id": "apr-translation_qa-20260803t053549z-cce14f",
  "project_id": "yt-smoke0p3aa",
  "gate": "translation_qa",
  "language": "zh",
  "approver": "human",
  "approver_role": null,
  "decision": "APPROVED",
  "artifact_hashes": [
    "sha256:a3b0d7337026b1ea00e09ae7a98200cbb68cd2638ed6bc321c6c502d40f1cdb7"
  ],
  "scope": "captions",
  "exclusions": [],
  "notes": null,
  "created_at": "2026-08-03T05:35:49Z",
  "expires_at": null,
  "invalidated_at": null,
  "invalidation_reason": null
}
