{
  "approval_id": "apr-audio_qa-20260811t025626z-c60663",
  "project_id": "yt-MFuUIoF5PSc",
  "gate": "audio_qa",
  "language": "pt",
  "approver": "Qaiser Abbas",
  "approver_role": null,
  "decision": "APPROVED",
  "artifact_hashes": [
    "sha256:b8c1af1d9f2dbf8791f921ef1053a8bd4d103f3c1669981af796fb8e5a109bd2"
  ],
  "scope": "audio",
  "exclusions": [],
  "notes": "Approved via /hi audio-sync QA review 2026-08-11: 0ms drift, 0 cues over tolerance/stretch-cap, no freeze plan (still-image project), max silent span 5220ms (under 7000ms threshold). Confirmed by Qaiser Abbas.",
  "created_at": "2026-08-11T02:56:26Z",
  "expires_at": null,
  "invalidated_at": null,
  "invalidation_reason": null
}
