{
  "approval_id": "apr-audio_qa-20260811t025626z-b3d352",
  "project_id": "yt-MFuUIoF5PSc",
  "gate": "audio_qa",
  "language": "ru",
  "approver": "Qaiser Abbas",
  "approver_role": null,
  "decision": "APPROVED",
  "artifact_hashes": [
    "sha256:78a82fb5d81d3c70d26a4df0291a8e7faf1dc48db0d176ac61b6b4b1fc92672d"
  ],
  "scope": "audio",
  "exclusions": [],
  "notes": "Approved via /hi audio-sync QA review 2026-08-11: 0ms drift, 0 cues over tolerance/stretch-cap, no freeze plan (still-image project), max silent span 5220ms (under 7000ms threshold). Confirmed by Qaiser Abbas.",
  "created_at": "2026-08-11T02:56:26Z",
  "expires_at": null,
  "invalidated_at": null,
  "invalidation_reason": null
}
