{
  "approval_id": "apr-audio_qa-20260811t025625z-96f411",
  "project_id": "yt-MFuUIoF5PSc",
  "gate": "audio_qa",
  "language": "en",
  "approver": "Qaiser Abbas",
  "approver_role": null,
  "decision": "APPROVED",
  "artifact_hashes": [
    "sha256:b2e39ee1b2c7a7906d9a439508457dc80829d5c9cc2691a38f373359af5b9614"
  ],
  "scope": "audio",
  "exclusions": [],
  "notes": "Approved via /hi audio-sync QA review 2026-08-11: 0ms drift, 0 cues over tolerance/stretch-cap, no freeze plan (still-image project), max silent span 5220ms (under 7000ms threshold). Confirmed by Qaiser Abbas.",
  "created_at": "2026-08-11T02:56:25Z",
  "expires_at": null,
  "invalidated_at": null,
  "invalidation_reason": null
}
