{
  "approval_id": "apr-audio_qa-20260807t115217z-0a9519",
  "project_id": "yt-YP0FDR7Wc-8",
  "gate": "audio_qa",
  "language": "en",
  "approver": "Qaiser Abbas",
  "approver_role": null,
  "decision": "APPROVED",
  "artifact_hashes": [
    "sha256:66f288a4fc4cc9f078ceb58a02fe96e9548962f9fcca6c64f2508144843c5644"
  ],
  "scope": "audio",
  "exclusions": [],
  "notes": "audio_qa APPROVE en (re-dubbed MALE, supersedes prior female dub). audio-sync PASS: 220 cues, 0 over-tol, 0 over-cap. Model B hold-only, 3 holds/2706ms. Accepted one-sided residual: picture lags audio 924ms under disclosed raised per_cue_drift_tolerance_ms=3600. Human confirmed in-conversation 2026-08-07 (rule 13 disclose+confirm).",
  "created_at": "2026-08-07T11:52:17Z",
  "expires_at": null,
  "invalidated_at": null,
  "invalidation_reason": null
}
